<?xml version="1.0" encoding="iso-8859-1"?>
<!DOCTYPE alfs SYSTEM "../DTD/ALFS.dtd"
[
<!ENTITY % general_entities SYSTEM "../config/general.ent">
<!ENTITY % package_entities SYSTEM "../config/package.ent">

%general_entities;
%package_entities;
]>
<alfs>
  <package name="zlib" version="&zlib-version;">
    <stage name="Unpacking">
      <unpack>
        <reference>&repository_url;/&zlib-package;</reference>
        <archive>&packages_dir;/zlib/&zlib-package;</archive>
        <destination>&build_dir;</destination>
      </unpack>
    </stage>
    <stage name="Patching">
    </stage>
    <stage name="Compiling">
      <stageinfo>
        <base>&build_dir;/&zlib-directory;</base>
        <environment>
          <variable name="CC">avr32-linux-gcc</variable>
          <variable name="CFLAGS">-O2</variable>
        </environment>
      </stageinfo>
      <configure>
        <param>--prefix=/usr</param>
        <param>-shared</param>
      </configure>
      <make />
    </stage>
    <stage name="Installing">
      <stageinfo>
        <base>&build_dir;/&zlib-directory;</base>
      </stageinfo>
      <copy>
        <option>force</option>
        <source>libz.so.&zlib-version;</source>
        <destination>&root_dir;/usr/lib</destination>
      </copy>
      <link type="symbolic" base="&root_dir;/usr/lib">
        <target>libz.so.&zlib-version;</target>
        <name>libz.so.1</name>
      </link>
    </stage>
    <!--
    <stage name="Strip">
      <remove>&build_dir;/&zlib-directory;</remove>
    </stage>
    -->
    <!--
    <stage name="Cleanup">
      <remove>&build_dir;/&zlib-directory;</remove>
    </stage>
    -->
  </package>
</alfs>
