<?xml version="1.0" encoding="iso-8859-1"?>
<!DOCTYPE alfs SYSTEM "../DTD/ALFS.dtd"
[
<!ENTITY % general_entities SYSTEM "../config/general.ent">
<!ENTITY % package_entities SYSTEM "../config/package.ent">

%general_entities;
%package_entities;
]>
<alfs>
  <stage name="dev files">
    <stageinfo>
      <base>&root_dir;/dev</base>
    </stageinfo>
    <execute command="mknod">
      <param>-m 600</param>
      <param>console</param>
      <param>c 5 1</param>
    </execute>
    <execute command="mknod">
      <param>-m 666</param>
      <param>null</param>
      <param>c 1 3</param>
    </execute>
    <execute command="mknod">
      <param>-m 666</param>
      <param>zero</param>
      <param>c 1 5</param>
    </execute>
    <execute command="mknod">
      <param>-m 666</param>
      <param>ptmx</param>
      <param>c 5 2</param>
    </execute>
    <execute command="mknod">
      <param>-m 666</param>
      <param>tty</param>
      <param>c 5 0</param>
    </execute>
    <execute command="mknod">
      <param>-m 444</param>
      <param>random</param>
      <param>c 1 8</param>
    </execute>
    <execute command="mknod">
      <param>-m 444</param>
      <param>urandom</param>
      <param>c 1 9</param>
    </execute>
    <ownership user="root" group="tty">
      <name>console</name>
      <name>ptmx</name>
      <name>tty</name>
    </ownership>
  </stage>
</alfs>
